word,translation,phonetic,mastered,sentences
"penicillin","NOUN. 青霉素，盘尼西林","/ˌpenɪˈsɪlɪn/","✓","This Scottish bacteriologist accidentally discovered the antibiotic penicillin after bacteria-killing fungus formed on staphylococci cultures he had left unattended.;He discovered penicillin largely accidentally.;The pharmacist filled my prescription for penicillin."
"perceive","VERB. 感知，察觉，觉察到，觉察，看待","/pəˈsiːv/","✗","Humans and birds can perceive color.;The people are encouraged to perceive their liberation in historic terms and to trust that new events will partake of past glories.;[…] tolerance (Frenkel-Brunswik 1949) for it showed that those persons with the strongest defences against internal conflict, i.e. obsessionals and conversion hysterics, were those least able to perceive the reality-conflicting phenomenon of phi."
"perception","NOUN. 感知，知觉，看法，认知，观感，感性，观念，感受","/pəˈsepʃn/","✗","About a couple of miles out lay an ironclad very low in the water, almost, to my brother's perception, like a water-logged ship. This was the ram Thunder Child.;have perception of time;That interpretation certainly colors my perception of the book."
"perpetrator","NOUN. 罪犯，肇事者，作案","/ˈpɜːpətreɪtə(r)/","✗","The catch of the perpetrator was the product of a year of police work.;The victim was able to enforce his evidence against the alleged perpetrator.;perpetrator of violence"
"perpetual","ADJ. 永续，永久，永恒，永久性，没完没了，永","/pəˈpetʃuəl/","✗","perpetual copyright;There are perpetual requests for changes as new payloads and new demands and modifications are suggested by the users.;By means of artificial hybridization, practised for a series of years, he has succeeded in producing a race of carnations which are perpetual bloomers."
"perspective","NOUN. 视角，透视，角度，角度来看，透视图，视野，观点，前景，展望，看法","/pəˈspektɪv/","✗","Perspective view of the gear, showing important parts: b, beam; bl. belly; br, brail; bt, bating; c cod end, or bag;;a perspective drawing;The present study focusses on the 'other' North American variety of English, Canadian English (CanE) from a diachronic perspective."
"piracy","NOUN. 盗版，海盗，翻版，侵权行为，侵权","/ˈpaɪrəsi/","✗","The Agreement criminalizes end-user piracy and requires Australia to authorize the seizure, forfeiture, and destruction of counterfeit and pirated goods and the equipment used to produce them.;How should the international community respond to Somali piracy?;Some video game consoles use specially designed cartridges to make software piracy more difficult."
"pivot","NOUN. 枢轴，支点，枢纽，透视，轴心，枢 ADJ. 先导","/ˈpɪvət/","✗","There is a special play called “Passing the Star” that allows the jammer to remove her helmet panty and hand it over to the pivot.;The tractive and braking forces are transmitted to the body through a downward projecting pivot pin in the normal way.;to bush a pivot hole"
"plain","NOUN. 平原 ADJ. 纯，平淡，普通，朴素，平，朴实，素，平面","/pleɪn/","✗","He was dressed simply in plain black clothes.;a plain tune;a plain pink polycotton skirt"
"plead","VERB. 申辩，求情，恳求，辩护，恳请，认罪，答辩","/pliːd/","✗","The defendant has decided to plead not guilty.;It is no defence to plead that you were only obeying orders.;I have actioned him for Libel, but he won’t plead, and says he will make himself bankrupt & won’t pay a penny."
"pocket","NOUN. 口袋里，口袋，袖珍，兜里，衣袋里，进口袋里，袋，衣袋，兜","/ˈpɒkɪt/","✗","I paid for it out of my own pocket.;There was, for much of the period, no cheap public transport; and even the Underground, or one of Shillibeer's horse-drawn omnibuses, was beyond the pocket of many of the poor.;The drilling expedition discovered a pocket of natural gas."
"polarization","NOUN. 两极分化，偏振，极化，偏振态，保偏，两极化，偏振光，偏光，分化","/ˌpəʊləraɪˈzeɪʃn/","✗","remanent magnetism; remanent induction; remanent polarization;Polarization is tearing at the seams of democracies around the world, from Brazil and India to Poland and Turkey.;If two of the California honeys, western hyssop and fleabane, having a positive polarization at 200 C. are disregarded, then the remaining..."
"political","ADJ. 政治，政界，政制，政局，政","/pəˈlɪtɪkl/","✗","Political principles are rarely absolute, as political logic holds an imperfect result by compromise is better than a theoretically perfect abstention from the political process in the opposition.;That brief moment after the election four years ago, when many Americans thought Mr. Obama’s election would presage a new, less fractious political era, now seems very much a thing of the past.;Good political staff is hard to find, they may neither be ambitious and corrupted by power nor tempted by private sector careers."
"poll","NOUN. 民意调查，民调，民意测验，轮询，投票，调查，人头，赛特","/pəʊl/","✗","The student council had a poll to see what people want served in the cafeteria.;The other returns having come in, the result of the poll, that Sir James Graham had been superseded by Major Aglionby, was declared at Carlisle soon after 11 a.m.;And you might perceive the president and general manager, Mr. R. G. Atterbury, with his priceless polished poll, busy in the main office room dictating letters.."
"portal","NOUN. 门户，门户网站，入口，洞口 ADJ. 门，后门","/ˈpɔːtl/","✗","The local library, a portal of knowledge.;The new medical portal has dozens of topical categories containing links to hundreds of sites.;the portal vein"
"portfolio","NOUN. 投资组合，组合，证券投资组合，有价证券，文件夹","/pɔːtˈfəʊliəʊ/","✗","I would like to introduce you to our portfolio of services.;product portfolio;Getting your book (portfolio) organised is the first step, and knowing both what to include, and what to leave out, is an essential step towards achieving that important agency placement."
"pour","VERB. 倒，倒入，倾吐，倾泻，倾注，浇 NOUN. 倾","/pɔː(r)/","✗","pour water from a jug;pour wine into a decanter;to pour oil onto chips"
"pragmatic","ADJ. 语用，务实，语用学，注重实效，求真务实，实用主义，实事求是，踏实，求实，实用","/præɡˈmætɪk/","✗","The sturdy furniture in the student lounge was pragmatic, but unattractive.;Polybius’s pragmatic history is simply the history of affairs, as distinguished from the descriptive and often poetical character which much history before his time had.;In other words, data are (re)constructed in the process of transcription as a result of multiple decisions that reflect both theoretical and ostensibly pragmatic considerations."
"predatory","ADJ. 食肉，掠夺性，掠夺式，掠夺 NOUN. 捕食","/ˈpredətri/","✗","predatory lending;predatory inclusion;predatory publishing"
"pregnancy","NOUN. 妊娠，怀孕，孕，孕期，妊娠期，妊娠期肝，受孕，孕妇","/ˈpreɡnənsi/","✗","Shortly after I announced my pregnancy, he stole my thunder with his news of landing his dream job.;Swollen breasts, morning sickness, and a missed period are classic symptoms of pregnancy.;I was hanging clothes in the garden and I overheard the neighbours talking about Sheila's pregnancy."
"premier","NOUN. 总理，国务院总理，温总理，首相，温家宝 ADJ. 首屈一指，首要","/ˈpremiə(r)/","✗","South Africa′s golfing greats battle it out on one of the country′s premier courses.;PREMIER, a. This French word, which signifies first, is used by English Heralds to signify the most ancient Peer of any Degree by Creation; as Premier Baron, &c.];[…]dau. of Lord Forbes, Premier Baron of Scotland (the Cumine family were of very ancient date[…])"
"primal","ADJ. 原始","/ˈpraɪml/","✗","[T]he attempt to arrive at a physical explanation of existence led the Ionian thinkers to postulate various primal elements or simply the infinite τὸ ἀπειρον.;Behold! I rise from primal silence / As a storm crushing dismal shores ov Acheron;primal man"
"primary","ADJ. 原发性，初级，主要，首要，初步，主，小学，基层，原，基本，一次","/ˈpraɪməri/","✗","Children attend primary school, and teenagers attend secondary school.;the church of Christ, in its primary institution;, Book II, Chapter VIII
These I call original, or primary, qualities of body."
"prison","NOUN. 监狱，狱，坐牢，监禁，牢狱，牢，监牢，徒刑，入狱，牢里，战俘","/ˈprɪzn/","✗","The cold stone walls of the prison had stood for over a century.;Prison was a harrowing experience for him.;The academy was a prison for many of its students because of its strict teachers."
"progressive","ADJ. 渐进，进步，累进，渐进式，逐步，进取，逐渐 NOUN. 进","/prəˈɡresɪv/","✗","a progressive school;progressive paralysis;a progressive politician"
"propel","VERB. 推动，驱使","/prəˈpel/","✗","Primary mass relays can propel ships thousands of light years, often from one spiral arm of the galaxy to another.;I can discern your nature and see that even without any arguments (logoi) from me it will propel you to what you say you are drawn towards,;Black women helped propel Harris and president-elect Joe Biden to victory by elevating turnout in places like Detroit, Milwaukee and Philadelphia."
"prosecute","VERB. 起诉，检控，提出检控，检举，提起诉讼","/ˈprɒsɪkjuːt/","✗","to prosecute a man for trespass, or for a riot;to prosecute a right or a claim in a court of law;to prosecute a scheme, hope, or claim"
"prosecution","NOUN. 检控，起诉，检察机关，提出检控，检方，追诉，公诉，检察，控诉","/ˌprɒsɪˈkjuːʃn/","✗","The prosecution presented a cogent argument, convincing the jury of the defendant's guilt.;The prosecution of the war fell to Winston Churchill.;The prosecution advanced a weak case."
"prosecutor","NOUN. 检察官，公诉人，检控官，检举，原告，检察，检方，检察院","/ˈprɒsɪkjuːtə(r)/","✗","The affair led to a crisis in relations between France and the Principality, with the French Government overruling Prince Rainier by refusing to extend the mandate of Monaco's Chief Prosecutor;Annie Jay was the Wisconsin government prosecutor in the trial of a man for forging his client's signature.;The prosecutor got the witness to admit he was lying."
"prosperity","NOUN. 繁荣，富裕，兴盛，昌盛，繁荣昌盛，兴旺，富强，繁华，荣","/prɒˈsperəti/","✗","...he shouldn't...just...[say]...""I -- I am responsible for prosperity,""...that's Communism, Sir, you see.;The country reached a high level of prosperity in his first term.;This is our vital mission to ensure opportunity and prosperity for all people and future generations. I am determined to deliver. Thank you."
"prosthetic","ADJ. 假肢，人工","/prɒsˈθetɪk/","✗","As the novel progresses, he is shot in the hand with his own gun, shot in the arse with someone else's and lacerated by a prosthetic weed trimmer.;[T]he United States Supreme Court had determined […] that artificial testicles were kosher under this law, but prosthetic penii clearly were not.;She's a licensed prosthetist, meaning, she fits prosthetic limbs to people after an amputation."
"pump","NOUN. 泵，水泵，油泵，泵浦，体外循环，抽","/pʌmp/","✗","This pump can deliver 100 gallons of water per minute.;This pump is out of order, but you can gas up at the next one.;Want a skin-stretching pump? Up the volume by using high-rep sets.
A great pump is better than coming. (Arnold Schwarzenegger)"
"purge","VERB. 清除 NOUN. 吹扫，整肃，通便，净化，清洗","/pɜːdʒ/","✗","he prescribes a Purge or a Vomit;Cromwell had Colonel Pride purge Parliament of royalists who opposed Charles I's execution.;Does money fail?—come to my mint—coin paper,
Till gold be at a discount, and ashamed
To show his bilious face, go purge himself,"
"quadrennial","ADJ. 连续四年的，每四年一次的 NOUN. 第四周年","/kwɒdˈren.i.əl/","✗","The quadrennial election of Chief Magistrate has passed off with less than the usual excitement.;The World Cup is awarded to the winner of a quadrennial football tournament.;The quadrennial period of games and festivals in Greece was probably arrived at by bisecting an older octennial period."
"radicalization","NOUN. 激进","/ˌrædɪkəlaɪˈzeɪʃn/","✗","The report identified four steps in the process of radicalization: pre-radicalization, self-identification, indoctrination and jihadization.;Silber and Bhatt (2007) examined individual-level radicalization and developed a model that consisted of a distinct series of steps: pre-radicalization, self-identification, indoctrination, and jihadization.;From there, it was only a short step to “Kekism,” at once a joke religion and a precursor of the reactionary radicalization to follow."
"rally","NOUN. 集会，反弹，拉力赛，涨势，拉力，集结，上涨，回升，大会，集合 VERB. 团结","/ˈræli/","✗","a campaign rally;an election rally;a political rally"
"ramble","NOUN. 絮絮叨叨 VERB. 漫谈 ADJ. 逍遥","/ˈræmbl/","✗","The place was a favourite with all, and the ramble in this quarter was quite a regular custom of the afternoon with the fair heiress of Colonel Walton in particular.;Francine has a tendency to ramble when it gets to be late in the evening.;My lovely ramble through the bright woods, as I had been fooling myself, gave itself over to the sober truth: became a slippery footslog through the gloom, ..."
"rape","NOUN. 强奸，油菜，强奸罪，强暴，强奸案，油菜花，奸，菜籽","/reɪp/","✗","Last April the media world exploded in indignation at the rape and beating of a jogger in Central Park.;Castor and Pollux are one set of twins birthed by Leda after her rape by Zeus in swan form; […];For quotations using this term, see Citations:rape."
"rational","ADJ. 理性，合理，有理，理智，合理性","/ˈræʃnəl/","✗","Man is a rational creature.;The utility of valid arguments is a monument to our frailty: to the fact that we are not completely rational beings.;His statements were quite rational."
"rebel","NOUN. 反叛，叛军，叛逆，反叛者，造反，义军，叛乱，叛逆者，反抗，反对派，叛徒","/ˈrebl/","✗",""" Heretics and schismatics, because they rebel against her, and only belong to the church, as deserters to an army from which they have ran away ;[…];My little sister is such a rebel - coming home late, piercing her ears, and refusing to do any of her chores.;to rebel against the system"
"recapture","VERB. 夺回，重新夺回，重温","/ˌriːˈkæptʃə(r)/","✗","The recapture of the escaped prisoner made the news.;The warden hoped to recapture the escaped prisoners before they reached the town.;New engine designs permit the vehicle to recapture the kinetic energy lost through braking."
"receipt","NOUN. 收据，收到，张收据，收条，接获，收货，发票，接收，接到","/rɪˈsiːt/","✗","A balance payable on receipt of the goods.;It has become a place of great receipt.;So, Andy, if you ask me nicely, I might produce a receipt that is my marriage certificate."
"recognize","VERB. 认出，认识，认得，承认，识别，认清，认，认可，意识到，确认","/ˈrekəɡnaɪz/","✗","In plants, the ability to recognize self from nonself plays an important role in fertilization, because self-fertilization will result in less diverse offspring than fertilization with pollen from another individual.;The US and a number of EU countries are expected to recognize Kosovo on Monday.;I recognize that my behaviour has been unacceptable."
"reflection","NOUN. 反思，反射，反映，倒影，思考，反省，体现，反光，映像，沉思","/rɪˈflekʃn/","✗","The dog barked at his own reflection in the mirror.;After careful reflection, I have decided not to vote for that proposition.;Our recent results are a reflection of the progress we've made as a team."
"regardless","ADV. 无论，不管，不论，不顾，无论如何，无关，不管怎样","/rɪˈɡɑːdləs/","✗","Tatiana knew the meat had passed its expiry date, but she ate it regardless.;I grew, day by day, more moody, more irritable, more regardless of the feelings of others.;Tatiana ate the cauliflower regardless its colour."
"registry","NOUN. 注册表，登记处，注册处注册，注册，档案室，登记，登录，登记册","/ˈredʒɪstri/","✗","Mr. F. Haydon said he was an undertaker at Stockwell. He conducted the funeral of W. Raven, the registry of whose death was proved by Mr. Booth;The best — and easiest — way to shop for the ""perfect"" gift is to consult the couple's wedding gift registry, since these are the items they want and need […];To unregister a DLL and remove the corresponding entries from the registry, add the /u switch to the command […]"
"reinstate","VERB. 恢复，复职","/ˌriːɪnˈsteɪt/","✗","Second Adam from above,
Reinstate us in thy love.;The old homepage for L2TP, www.l2tpd.org, has been squatted by a domain squatter. A malicious person could reinstate this domain with malicious code on it.;[…] they also instrumentalize race to reinstate nostalgic, vanguard notions of political activism […]"
"reiterate","VERB. 重申，再次重申，反复强调，再三","/riˈɪtəreɪt/","✗","Well, let me reiterate them and then explain why, in my view, this response is bad PR.;Let me reiterate my opinion.;Was I hard to understand? Sorry, I'll try to reiterate."
"relieve","VERB. 缓解，减轻，纾缓，解除，舒缓，纾解，救济，免除，减缓","/rɪˈliːv/","✗","This shall not relieve either Party of any obligations.;Nevertheless, to relieve oneself takes the edge off the desire and doesn't take advantage of others.;It was therefore concluded that the Abigails should, by turns, relieve each other on one of his lordship’s horses, which was presently equipped with a side-saddle for that purpose."
"religious","ADJ. 宗教，信教，宗教信仰，虔诚，信仰","/rɪˈlɪdʒəs/","✗","It is the job of this court to rule on legal matters. We do not consider religious issues.;I was much more religious as a teenager than I am now.;I'm a religious fan of college basketball."
"relitigate","X. 再次起诉，再次提出诉讼","rɪlˈɪtɪɡˌeɪt","✗",""
"residence","NOUN. 住宅，居留，居住，住所，官邸，居所，住处，民居，停留","/ˈrezɪdəns/","✗","an upcountry residence;By 1960 the growth and development of Chicago's black areas of residence confirmed the existence of the city's second ghetto.;waters of a muddy residence"
"residential","ADJ. 住宅，居住，住宿，住宅区，民居，居住区，居民，小区，住房，居","/ˌrezɪˈdenʃl/","✗","Columbus dwellers of Woodland Meadow Apts may not find themselves in a perfectly bucolic setting, as the residential complex gives onto a military defense logistics ground.;They live in a residential neighborhood.;There is a residential requirement for obtaining a marriage license here."
"resilience","NOUN. 韧性，回弹，复原力，弹性，坚韧，复原","/rɪˈzɪliəns/","✗","An almost otherworldly resilience has characterized the 40-year arc of the Clintons’ political lives, a well-documented pattern of dazzling success, shattering setback and inevitable recovery.;The second phase of resilience work at Dawlish station began on November 5, with the arrival off the coast of an eight-legged walking jack-up barge known as a Wavewalker.;Providing technical support to regional climate and WSG focals of all operational divisions on water resilience will amplify the larger pool of project officers."
"resilient","ADJ. 弹性，回弹，富有弹性，坚韧，坚韧不拔，韧性","/rɪˈzɪliənt/","✗","He’s resilient, and strong, but sometimes tonight, here, the weight of what he’s saying makes him stop, pause as if lost.;The virus has mutated into a more resilient version.;Generally, varieties in current use for processing are resilient, if not wholly resistant to blemishing diseases and disorders."
"resistance","NOUN. 阻力，电阻，抵抗，抗，耐，耐药性，阻，抵抗力，反抗，性，性能","/rɪˈzɪstəns/","✗","widespread resistance to the new urban development plans;Alliance forces are stretched too thin right now to attempt to liberate the colony, but we've been doing what we can to covertly aid the local resistance.;take the path of least resistance"
"resolute","NOUN. 坚决，果断，果敢，刚毅，坚毅，坚 ADJ. 坚定，坚定不移","/ˈrezəluːt/","✗","She was resolute in her determination to resist his romantic advances.;He was resolute in his decision to stay.;vector resolute"
"restless","ADJ. 不宁，焦躁不安，不安，躁动不安，坐立不安，躁动，烦躁不安，焦躁，烦躁，无休止","/ˈrestləs/","✗","The night before his wedding was a restless one.;He was a restless child.;She sat, restless and nervous, and tried to concentrate."
"retirement","NOUN. 退休，退休金，退役，养老","/rɪˈtaɪəmənt/","✗","""I tried retirement ten years ago. Didn't think much of it. Complete waste of time. So I gave it up after two weeks."";recognizing the societal deal between capital and labor regarding retirement savings;As he had worked for the CIA for over 30 years, he would soon take retirement from the company."
"retrace","VERB. 折回，追溯","/rɪˈtreɪs/","✗","Although most cards still support screen-tweaking, you can just forget about copperbars (writing within horizontal retrace fuks up the screen BADLY) and other effex. Same goes for changing the font.;Board a vintage rail car and retrace the original route to the summit of White Pass where you will have a toast and snack provided by your personal costumed guide.;The next step, I am thinking about, is to retrace the pathway of the spread of rubber to the riverine society of the Amazon."
"retreat","NOUN. 撤退，退却，退路，退缩，静修，退，务虚，后退，倒退，撤离","/rɪˈtriːt/","✗","... he built his son a house of pleasure, on purpose to keep him out of harm's way; and spared neither art nor cost to make it a delicious retreat.;We both need a week retreat after those two stressful years working in the city.;The general opted for a swift retreat because he saw his troops were vastly outnumbered."
"revert","NOUN. 复归，还原 VERB. 恢复","/rɪˈvɜːt/","✗","Zeba Siddiqui, herself a revert and editor of the Parent's Manual: A Guide for Muslim Parents Living in North America, contributed to this book as a consultant.;Parents should not reject a proposal without good reason — and being a revert with a past is not an acceptable one.;When a book goes out of print, rights revert from the publisher to the author."
"rhetoric","NOUN. 修辞，修辞学，花言巧语，言辞，言论，说辞，辞令，豪言壮语，夸夸其谈，论调，措辞","/ˈretərɪk/","✗","It is rather confused rhetoric to call a grafter a thief. His crime is not that he filches money from the safe but that he betrays a trust.;It’s only so much rhetoric.;You need to tone down the rhetoric."
"rightsholder","X. [网络] 有权者；权利持有者；特定财产的权利拥有者","rˈaɪtshəʊldə","✗",""
"rigid","ADJ. 刚性，僵化，硬质，刚，硬性，死板，刚体，僵硬，硬，严格，坚固","/ˈrɪdʒɪd/","✗","This kind of immediate control structure we take to be characteristic of the tribe, and it leads to a rather rigid type of system in which 'every action not mandatory is forbidden'.;When two or more arm-joints meet transversely by a rigid suture, and only the upper one is pinnule-bearing, those joints form a syzygy, whether their apposed faces are striated, dotted, or smooth.;A sunflower, four more, one bowed, and horses in the distance standing rigid and still as toys."
"rock","NOUN. 岩石，岩，摇滚，摇滚乐，石头，磐石，石，块石头，岩层，矿","/rɒk/","✗","The face of the cliff is solid rock.;Some fool has thrown a rock through my window.;Look at the size of that rock on her finger!"
"romance","NOUN. 浪漫，罗曼史，恋情，浪漫史，言情，浪漫爱情，爱情，恋爱，罗曼，传奇","/rəʊˈmæns/","✗","His life was a romance.;She was so full of romance she would forget what she was supposed to be doing.;In this paper we will concentrate on the problem posed by Iberian Romance languages (i.e. Catalan, Portuguese, and Spanish), …"
"roof","NOUN. 屋顶，顶板，屋面，房顶，屋盖，屋檐，楼顶，顶，顶棚，天台","/ruːf/","✗","The roof was blown off by the tornado.;'Twas the house I'd seen the roof of from the beach.;The very first sound that you’ll hear on the roof
(Provided there’s fog) will be Rudolph’s small hoof."
"roughly","ADV. 大致，大约，粗略，约，大概，大体，大体上，差不多，左右","/ˈrʌfli/","✗","They treated the prisoners roughly … slashing pitilessly with their whips to drive them as wretched animals before them.;Satanism can be divided, roughly, into two branches: the Luciferians and the Palladists.;Of the roughly 400 emerging infectious diseases that have been identified since 1940, more than 60% are zoonotic: ie they came from animals. Throughout history this has been common."
