word,translation,phonetic,mastered,sentences
"abjection","NOUN. 卑鄙，落魄，抛弃，驱逐","/æbˈdʒek.ʃən/","✗","an abjection from the beatific regions where God, and his angels and saints, dwell forever;The abjection of the king and his realm.;a. 1639, Joseph Mede, a sermon
ingenerate or encrease this disposition of lowlineſſe and abjection"
"accelerant","NOUN. 助燃剂，触媒","/əkˈsel.ə.rənt/","✗","Accelerant was poured across the beds where the two daughters of a family in Cheshire, Conn., had been tied before a fire during a home invasion in 2007, a fire investigator told jurors on Friday.;Hello Neighbor’s experience reflects the rise of video sites like YouTube as an accelerant for the video game business.;[Mike] Skinner can be credited with pouring lots of accelerant on pop in his time. In his absence, Caribbean-derived UK bass music became the de facto sound of British youth."
"accordingly","ADV. 据此，相应，因此，为此","/əˈkɔːdɪŋli/","✗","Our preparations were all finished. Accordingly, we set sail.;He was absent when I called, and I accordingly left my card.;From the Marvel Mixmaster to the Miracle Microwave, every time a new-fangled gadget has lobbed into the Aussie kitchen, Aussie mums have changed their cooking styles accordingly."
"adopt","VERB. 采用，采取，采纳，收养，领养，采","/əˈdɒpt/","✗","We're going to adopt a Dalmatian.;to adopt the view or policy of another;Every society should adopt an order of business adapted to its special wants."
"affiliate","NOUN. 代销商，联属，子公司，联盟，从属，会员，附属，加盟，分支机构，下属","/əˈfɪlieɪt/","✗","Our local TV channel is an affiliate of NBC.;They used to been more of a Detroit channel, as they had showed a lot of American programs, aside from being the CBC affiliate.;to affiliate the child to (or on or upon) one man rather than another"
"algorithmically","X. [计] 在算法上","æl'ɡɒrɪθmɪklɪ","✗",""
"alienate","VERB. 疏远，离间，疏离","/ˈeɪliəneɪt/","✗","Henry knew better than to alienate one of the Acme secretaries.;The principal force and property of hatred then, is to divide, separate, alienate, and elongate a man from what he hates.;This essentially urban lifestyle, modelled on the factory artel, did much to alienate the local peasantry […]"
"alienation","NOUN. 异化，疏离，异化现象，疏远，隔阂","/ˌeɪliəˈneɪʃn/","✗","Perhaps being in a touring band was, to Yorke, a synecdoche for the modern condition: disorientation, alienation, rootlessness, exhaustion, lack of control, occasional derangement, constant motion.;The alienation of that viewing demographic is a poor business decision.;Wearing an Audie Murphy black jacket, playing a Chuck Berry guitar, and performing his electrified alienation with passionate indifference, Dylan assassinated the audience."
"alliance","NOUN. 联盟，同盟，结盟，联，北约，加盟，盟友","/əˈlaɪəns/","✗","an alliance between church and state, or between two countries;And as for kindred , there is no Alliance neerer vnto any one, than their Countrey , that is to be vnto vs another God, and our prime and deareſt Parent.;the alliance of the principles of the world with those of the gospel"
"alloy","NOUN. 合金，铝合金，合金钢","/ˈælɔɪ/","✗","gold without alloy;The sole grievance and alloy thus removed in the prospect of Harriet’s welfare, she was really in danger of becoming too happy for security.;to alloy gold with silver or copper, or silver with copper"
"alphanumeric","ADJ. 字母","/ˌælfənjuːˈmerɪk/","✗","Therefore, we need a special code to represent all alphanumeric data (letters, symbols, and numbers).;The last bit of information on each tombstone is an accession number—an alphanumeric block that is assigned when an object is added (accessioned) to the museums’ collections.;Basically, the Soundex algorithm converts each string into an alphanumeric code that begins with the first letter of the string."
"alternate","ADJ. 互生，交替，备用，候补，替代，备选，轮流，替换","/ɔːlˈtɜːnət/","✗","Alternate picking is a guitar playing technique.;The service is half-hourly as far as Harrogate and Knaresborough, with alternate trains going on to York.;Goldschmidt (Austria; creation July 27, 1862): … party, argent and gules, an eagle of alternate colors, …"
"altruism","NOUN. 利他主义，利他","/ˈæltruɪzəm/","✗","Thus Aurobindo Ghose stated that the puritanical, pharisaical British conquered in the name of liberty and usurped under the cloak of altruism.;The visitor in Man Facing South-east claims pure altruism; Rantes (Hugo Soto) wants to alleviate the suffering of the poor and helpless.;Finally, there is a microliterature on transfers (see Cox 1987 and Kotlikoff 1988 for summaries) that appears, on balance, to reject the altruism model."
"ambassador","NOUN. 大使，驻华大使，国宾，驻，形象大使，使者","/æmˈbæsədə(r)/","✗","Vergenne'fury reached its height when the priest tried to involve the English ambassador.;As front hall porter, you are an ambassador for the hotel.;Ambassador Udina: The other species are scared. They've never faced anything like this before and they don't know what to do."
"amend","VERB. 修订，修改，修正","/əˈmend/","✗","1990, Doug Hoyle, Hansard, Trade Union Act, 1984, Amendment no. 2, 4 July, 1990,
It is necessary to amend the Act to preserve the spirit in which it was first passed into law […];Thus by the code of the Visigoths, it was forbidden to all strangers to take their subjects under a penalty of one hundred lashes and an amend in gold.;Did I owe him an amend? Probably not, but I did owe myself an amend. I did this by ceasing to resent."
"amendment","NOUN. 修订，修正案，修订动议，项修正案，修正，修改","/əˈmendmənt/","✗","Arrests and prosecutions intensified after Isis captured Mosul in June, but the groundwork had been laid by an earlier amendment to Jordan’s anti-terrorism law.;The First Amendment guarantees freedom of religion, speech, press, assembly, and petition.;The Thirteenth Amendment to the United States Constitution abolished slavery."
"angst","NOUN. 焦虑","/æŋst/","✗","It would be an intense disgust. The absolute apex of teen angst.;Suitably daunted by ultracrepidarian angst, I record here some tentative readings in rhetoric's expanded domain and venture a few preliminary observations on their relation to the electronic word.;Harry's adolescence is theatrical and gaudy, and many of its key scenes have a lurid and camp quality that is appropriate to the exaggerated mood-shifting and self-dramatizing of teen angst."
"antibiotic","ADJ. 抗生素，抗菌素，抗菌，抗菌药物，抗菌药，抑菌","/ˌæntibaɪˈɒtɪk/","✗","For some presumptive diagnoses, empirical antibiotic therapy begins immediately, whereas specific antibiotic therapy must await the results of the culture and sensitivity test.;This Scottish bacteriologist accidentally discovered the antibiotic penicillin after bacteria-killing fungus formed on staphylococci cultures he had left unattended.;A.xenization was accomplished by rinsing the worms 3 times in sterile distilled water, followed by their transfer to 10 ml. antibiotic solution (1,000 units potassium penicillin G and 100 y streptomycin sulphate per ml.);"
"apologist","NOUN. 辩护者，教义辩护文作者 X. 辩护者，辩解者","/əˈpɒlədʒɪst/","✓","15 October 2019, Aleksandar Hemon, ""‘The Bob Dylan of Genocide Apologists’"" in The New York Times
A genocide denier is an apologist for the next genocide.;2008, Bob Sweere, ""Voice of the Day: Global warming? Yes,"" News-Leader.com (Missouri), 16 Jun. (retrieved 1 July 2008),
Global warming is settled, unless you are a flat earther or an energy company apologist.;The author of the Horæ Paulinæ is not, by any means, the ideal apologist who can give satisfaction to his richly emotioned soul."
"arbitrage","NOUN. 套利，套汇，差价","/ˈɑːbɪtrɑːʒ/","✗","Indeed, as banks become more adept at internal risk classifications, their incentives to arbitrage economic and regulatory capital can only increase;Simons runs a kind of supersophisticated arbitrage operation from his offices in Manhattan and in East Setauket […];Before the crisis, perhaps 70 percent of demand came from practitioners of convertible arbitrage, who aimed to profit from the interplay of the debtlike and equitylike characteristics of the securities."
"arguably","ADV. 按理说，可以","/ˈɑːɡjuəbli/","✗","Computer engineers were at a loss last night to explain why the Government had been hit by arguably the worst electronic meltdown in the history of Whitehall. https://web.archive.org/web/20041209011615/http://news.independent.co.uk/uk/politics/story.jsp?story=587262;The cervines are arguably Europe's greatest mammalian success story: the earliest type, Cervavitus, first appeared about 10 million years ago—in Europe.;The king of all quad exercises, and arguably the best single-weight resistance exercise, is the squat."
"arrest","VERB. 逮捕，抓 NOUN. 拘捕，骤停，被捕，停搏，抓捕，扣押","/əˈrest/","✗","A white Starre[…]whiche to every mans sighte did lighte and arrest apon the Standard of Albry.;to arrest someone on suspicion of bribery;The arrest was standard, when suddenly the suspect broke ugly."
"aspirational","X. 有抱负的，志同的","/ˌæspəˈreɪʃənl/","✗","...in keeping with the historically aspirational function of the section, what with its statusy wedding pages and full-page ads for diamonds and fur.;For the last several seasons, aspirational television — shows like “Lipstick Jungle,” “Cashmere Mafia,” “Dirty Sexy Money” and “Big Shots” — has pressed audiences to connect with characters who lead ultrafabulous lives.;Wonderful for both casual and formal occasions, these unique earrings combine aspirational materials that have been celebrated in both the West and the East for centuries."
"assistance","NOUN. 援助，协助，帮助，救助，辅助，资助，支援，援","/əˈsɪstəns/","✗","While I this unexampled task essay, / Pass awful gulfs, and beat my painful way, / Celestial Dove! divine assistance bring, / Sustain me on thy strong-extended wing,;I depended on them for assistance.;They're going to take away our draw! (referring to e.g. disability assistance)"
"astronaut","NOUN. 宇航员，航天员，太空人，名宇航员，宇航","/ˈæstrənɔːt/","✗","The astronaut Buzz Aldrin was the second person to walk on the Moon.;Becoming an astronaut was his grail.;The Women Flyers: From Aviatrix to Astronaut"
"atmosphere","NOUN. 气氛，大气，氛围，大气层，气息，空气","/ˈætməsfɪə(r)/","✗","Meronyms: see Thesaurus:atmosphere;Central Casting is in the business of extras, also known as atmosphere or background actors […];By the way, I discovered that we were not extras but background, as far as the director was concerned; and for the producer, we were atmosphere."
"attempt","NOUN. 尝试，企图，试图，试，未遂，意图","/əˈtempt/","✗","to attempt an escape from prison;to attempt the enemy's camp;We made an attempt to cross the stream, but didn't manage."
"attendee","NOUN. 与会者","/əˌtenˈdiː/","✗","O'Reilly, the summit host, remembers a particularly insightful comment from Torvalds, a summit attendee.;PhD candidate and attendee NatalieZed (2015a, 2015b) instead Voldemorted the hashtag by using #Deatheaters – a term for Voldemort’s supporters, also from the Harry Potter novels – to refer to Gamergate harassers: […];10) Burden of expense All expenses, for attending, applying and/or presenting, at the conference will be the responsibility of the attendee or presenter unless stated above."
"attorney","NOUN. 律师，检察官，受权，检察长，代理人，辩护律师，检察，律政司","/əˈtɜːni/","✗","...the prosecuting attorney referred to the defendant as a “murderer” in one instance, and in another as a “redhanded murderer.”;Some stick not to say, that the Parson and Attorney forg’d a Will, for which they were well Paid […];My attorney was waiting in a bar around the corner. “This won't make the nut,” he said, “unless we have unlimited credit.”"
"attribute","NOUN. 属性，定语","/əˈtrɪbjuːt/","✓","His finest attribute is his kindness.;This packet has its coherency attribute set to zero.;A file with the read-only attribute set cannot be overwritten."
"autocrat","NOUN. 独裁者","/ˈɔːtəkræt/","✗","2012, The Economist, Sep 29th 2012 issue, Venezuela’s presidential election: The autocrat and the ballot box
Mr Chávez remains a formidable opponent. […] He has an armlock on the country’s institutions.;The parrot particularly, which may be considered the autocrat of the feathered tribes leads all birddom in the number and variety of diseases to which it is subject.;We tend to justify superstatus, superauthority, and superreward with the proposition that the autocrat must be held responsible for corporate performance."
"autonomy","NOUN. 自治，自主权，自治权，自主，高度自治，自律","/ɔːˈtɒnəmi/","✗","But while assiduously dismissing any though of its own autonomy and proclaiming its victims its judges, it outdoes, in its veiled autocracy, all the excesses of autonomous art.;...[T]he fact that a scientific theory finds applications to a wide variety of different phenomena does not imply anything about the autonomy of this theory from deeper physical laws.;When Nimeiri ended that autonomy in 1983, the south took up arms. This Second Sudanese Civil War ended only after four years of formal talks […]"
"backdrop","NOUN. 背景下，背景，天幕，幕布","/ˈbækdrɒp/","✗","The president spoke outside the brick exterior of the firehouse for Ladder Company 10 and Engine Company 10, against the backdrop of a 56-foot-long bronze bas-relief depicting the towers in flames.;Against a backdrop of falling interest rates, the new savings account is looking less appealing.;Against this backdrop, RDG said it needed to ""review historic working practices so that the railway can respond to changing passenger needs and enable future growth""."
"ballot","NOUN. 选票，投票，抽签，无记名投票，张选票，投票表决，选举权","/ˈbælət/","✗","July 1836, A. B. (initials of author), London and Westminster Review Article XI, Bribery and Intimidation at Elections
the insufficiency of the ballot;In the TSSA ballot, 80% of management grade and 60% of general grade members voted to accept, on an overall turnout of 57%.;to ballot for a candidate"
"bestselling","VERB. 畅销书，畅销","/ˌbestˈselɪŋ/","✗","THE SPIKE is the acclaimed bestselling superthriller of today-but it may be the frightening reality of tomorrow.;Bestselling author Christopher McDougall enthusiastically praised Laura's novel by calling it ""a hellride of a story"". He remarks on the ""courage"", ""adventure"", and ""charisma"" of Louis […];[…] including the 1925 silent film Peacock Feathers, based on the bestselling novel of the same name written by Temple Bailey (1885-1953)."
"bid","NOUN. 出价，投标，申办，竞标，竞价，招标，报价，招投标，收购，标","/bɪd/","✗","It has been repeatedly documented that moving patients from a TID dosing regimen to BID or OD vastly improves compliance, and thus the medicine's effectiveness.;In his cloak of words strode the ringmaster, / Bid me join the parade;Have you ever bid in an auction?"
"blame","VERB. 责怪，怪，责备，指责，怪罪，归咎，埋怨，谴责 NOUN. 责任","/bleɪm/","✗","Blame came from all directions.;The blame for starting the fire lies with the arsonist.;They accepted the blame, but it was an accident."
"blast","NOUN. 爆炸，爆破，鼓风，稻瘟病，爆，高炉，冲击波，炮，冲击 VERB. 炸","/blɑːst/","✗","many tons of iron were melted at a blast;Blast was produced by bellows worked by four 'blowers', three of whom worked at a time while the fourth stood ready to replace one of the others.;arc blast"
"blend","NOUN. 混合，交融，共混，混纺，共混物，融合，混，调和，配方 VERB. 融入","/blend/","✗","Their music has been described as a blend of jazz and heavy metal.;Our department has a good blend of experienced workers and young promise.;To make hummus you need to blend chickpeas, olive oil, lemon juice and garlic."
"bloat","NOUN. 膨胀，臃肿 VERB. 胀气","/bləʊt/","✗","1675, John Dryden, Prologue to Circe by Dr. Davenant
Encourage him, and bloat him up with Praise;Adding an e-mail feature to this simple text editor would be pointless bloat.;Let the bloat king tempt you again to bed"
"boredom","NOUN. 无聊，厌倦，厌烦，解闷，百无聊赖，乏味，苦闷，烦闷","/ˈbɔːdəm/","✗","numb with shock; numb with boredom;Most soldiers would testify that the everyday experience of war is long stretches of boredom punctuated by sudden, terrifying spells of disorder.;For all the boredom the straight life brings, it's not too bad."
"brag","VERB. 吹牛，吹嘘，自夸，炫耀，自吹自擂，夸耀","/bræɡ/","✗","to brag of one's exploits, courage, or money;a woundy, brag young fellow;'It's because he's a no-good son of a bitch who thinks it is smart to lay his friends' wives and brag about it.'"
"brain","NOUN. 大脑，脑，脑子，颅脑，人脑，脑袋，头脑","/breɪn/","✗","The left brain, or that which supplies and animates the right side of the body, is the most active brain, as a general rule.;She was a total brain.;Gerald always acts like he doesn't have a brain."
"bulk","NOUN. 大宗，批量，散装，散货，散，大块，体积，大部分，体","/bʌlk/","✗","The Quantity of Matter is the measure of the same, arising from its density and bulk conjunctly.;“ Didn't Balbus say this morning that, if a body is immersed in liquid, it displaces as much liquid as is equal to its own bulk? ” said Hugh.;By this process the body of the oyster acquires such a plumpness and rotundity, and its bulk and weight are so increased, as to materially increase its selling value."
"bumper","NOUN. 保险杠，缓冲器，丰收","/ˈbʌmpə(r)/","✗","Yet can I gulp a bumper to thy name,— / O smile among the shades, for this is fame!;We harvested a bumper crop of arugula and parsnips this year.;a bumper collection of silly jokes"
"buttress","VERB. 支持","/ˈbʌtrəs/","✗","Crowell Buttresses, Dismal Buttress;Two short pitches up a chimney-crack are followed by a traverse right to the centre of the buttress.;the grand pillar and buttress of the good old cause of nonconformity"
"cable","NOUN. 电缆，索，有线，有线电视，线缆，缆，缆索，拉索，光缆，电报，线","/ˈkeɪbl/","✗","Work sleeve, sl raglan marker, work in ribbing as est to cable marker;I tried to watch the movie last night but my cable was out.;He had warped round with the springs on his cable, and had recommenced his fire upon the Aurora."
"camp","NOUN. 营地，阵营，营，夏令营，训练营，露营，集中营，野营，军营，难民营，帐篷","/kæmp/","✗","a hunter's camp;Lantana is a sweet camp. It's an old hospital that has been converted to a drug treatment center for prisoners.;Some players like to camp next to a power-up's spawning point."
"candidacy","NOUN. 参选，候选人","/ˈkændɪdəsi/","✗","A scrum formed around Scott Brison in the House of Commons lobby shortly after he announced his candidacy for the federal Liberal leadership.;Let it be borne in mind, moreover, that since the period of his last candidacy he has rendered the most memorable services to the country;However, this almost certainly happened because of the third party candidacy of former Republican President Theodore Roosevelt"
"candle","NOUN. 蜡烛，支蜡烛，烛，根蜡烛，烛光，烛火，蜡","/ˈkændl/","✗","light a candle;snuff out the candle;The candle burns blue."
"capital","NOUN. 资本，首都，资金，资本金，首府，省会，资产，资","/ˈkæpɪtl/","✗","He does not have enough capital to start a business.;Washington D.C. is the capital of the United States of America.;Hollywood is the film capital, New York the theater capital, Las Vegas the gambling capital."
"capitalize","VERB. 大写，利用","/ˈkæpɪtəlaɪz/","✗","There was then a long discussion of whether to capitalize words like ""east"".;The home team took several shots on goal but was unable to capitalize until late in the game.;But the Dippers should hold their applause, since their party doesn't have the grassroots organization or the roster of good candidates it needs to capitalize on their leader's popularity."
"cast","VERB. 投，施放，投射，赶 NOUN. 铸，铸造，强制转换，铸态，演员","/kɑːst/","✗","Near Puerto Limon, Costa Rica, Madman, co-pilot and plane were caught in a storm, cast into the Caribbean, drowned.;when the serjeant saw me, he cast his coat and put it on me, and they carried me on their shoulders to a village where the wounded were and our surgeons[…].;You know the saying, ""Ne'er cast a clout till May is out""? Well, personally, I'm bored of my winter clothes by March."
"cauterize","X. 使麻木不仁，烧灼，烧灼，烙","/ˈkɔːtəraɪz/","✗","Ligate or cauterize small subcutaneous bleeders and identify the linea alba.;For a stronger vegetable flavor, you can cauterize vegetables on both sides in a dry hot skillet.;This point method is used to treat small areas of the skin, for example, to cauterize warts."
"cede","VERB. 割让，放弃","/siːd/","✗","Edward decided to cede the province.;Within a non-theme, transitionals cede to rhematics, the transition itself being lowest on the CD scale.;Instead, the shares are held by a superentity called Cede & Company in an arrangement administered by the Depositary Trust and Clearing Corporation."
"centrifuge","NOUN. 离心机，离心，料离心机","/ˈsentrɪfjuːdʒ/","✗","Turbinado is usually made by squeezing the juice out of crushed sugar cane, then spinning what's left after evaporation through a huge centrifuge.;Mr. Gannon loaded the racks inside the centrifuge with two beeless honeycombs, then stepped back and let Julian begin spinning them with a hand crank.;Start the securely anchored centrifuge and slowly increase to the proper speed (2000 – 2500 rpm). Solvent will be rapidly expelled from the drainpipe."
"ceremony","NOUN. 仪式，典礼，礼，庆典，婚礼，开幕式，礼节，礼仪","/ˈserəməni/","✗","a graduation ceremony, an opening ceremony;Monsieur Bridet, notwithstanding his costume and his evident harrassment [sic], found in himself the presence of mind to remain the attentive manager, and with ceremony effected the proper introduction.;They went into the bars and interrupted the drinking, hustling the men out without ceremony."
"certain","ADJ. 某些，一定，特定，某，肯定，确定，若干，一些，某个，有些","/ˈsɜːtn/","✗","I was certain of my decision.;Now that more experiments have been run, the theory is certain and the argument is settled.;It is certain that Spain will reach the finals. / Spain is now certain to reach the finals. / Spain is now certain of a place in the finals."
"challenger","NOUN. 挑战","/ˈtʃælɪndʒə(r)/","✓","The defending champion is expected to defeat his challenger.;The champion hopes to defeat his new challenger in the game to remain undefeated.;The launch temperature was a factor of the Challenger disaster."
"chronological","ADJ. 年代，年月，实足","/ˌkrɒnəˈlɒdʒɪkl/","✗","He is 67 in chronological age, but has the mind and body of someone 55.;The live report lists all the events in chronological order.;As a result, I shifted my approach to focus on group-generated activities and broadened the chronological time frame."
"church","NOUN. 教堂，教会，座教堂，堂，礼拜","/tʃɜːtʃ/","✗","There is a lovely little church in the valley.;This building used to be a church before being converted into a library.;These worshippers make up the Church of Christ."
"churn","NOUN. 流失，搅拌器","/tʃɜːn/","✗","a butter churn;the dasher of a churn;Yet another seriously under-par performance is unlikely to provide any real answers to their remarkable plummet in form - but it proves they can at least churn out a much-needed result."
"clout","NOUN. 影响力，底气，势力","/klaʊt/","✗","[…]ethics officers themselves often complain that they can recommend but have little clout with which to create real change.;The chopped mushrooms add depth to both the Waitrose and the Go-Go Vegan recipe, but what gives the latter some real clout on the flavour front is a teaspoon of Marmite.;‘Such a clout on the ear as you gave me… But I soon taught you.’"
"clunky","ADJ. 笨重，笨拙","/ˈklʌŋki/","✗","You might find yourself listening to the sound your car door makes when it shuts. Is it a cheap tinny sound or a strong clunky sound like the VW?;I could tell that some of the guests were confused by the name of Maggie―no-one had called her by that clunky, unfashionable name in years;That culture waned in the late 80's and the 90's —remember Jerry Seinfeld in his clunky, generic white sneakers— but now the sneakerhead is back."
