word,translation,phonetic,mastered,sentences
"dump","VERB. 倾倒，抛弃，甩，甩掉 NOUN. 转储，排土场，垃圾场，垃圾堆，倾销","/dʌmp/","✗","A toxic waste dump.;The new XML dump is coming soon.;This place looks like a dump."
"dwell","VERB. 纠缠，住，停留，居住，沉湎，详谈 ADJ. 驻留 NOUN. 沉溺","/dwel/","✗","an abjection from the beatific regions where God, and his angels and saints, dwell forever;I am fully resolved to go dwell in another house.;Well, since my baby left me,
Well, I found a new place to dwell.
Well, it's down at the end of Lonely Street
At Heartbreak Hotel."
"effort","NOUN. 努力，精力，力气，工作量，心血，功夫","/ˈefət/","✗","It took a lot of effort to find a decent-sized, fully-furnished apartment within walking distance of the office. He made a conscious effort to not appear affected by the stories in the paper.;The 30-year-old South Korean, who joined United in 2005, retired from international duty after last season's Asian Cup in an effort to prolong his club;Although he didn't win any medals, Johnson's effort at the Olympics won over many fans."
"elevate","VERB. 提高，抬高，升华","/ˈelɪveɪt/","✗","1750, Samuel Johnson, The Rambler, No. 25, 12 June, 1750, Volume 1, London: J. Payne and J. Bouquet, 1752, p. 216,
We know that a few strokes of the axe will lop a cedar; but what arts of cultivation can elevate a shrub?;[…] that’s the way things go when you elevate mediocre people to positions of authority.;A talented chef can elevate everyday ingredients into gourmet delights."
"eliminate","VERB. 消除，排除，消灭，杜绝，消，清除，淘汰，除去，取消，去除","/ɪˈlɪmɪneɪt/","✗","Eliminate illogical (read: stupid) answer choices.;Heaven will eliminate the tyrannical regimes.;Cross out answers as you eliminate them, and practice bubbling your answers on the sheet provided at the very end of the book."
"elite","ADJ. 精英，精锐，优秀，菁英，高水平 NOUN. 精英阶层，精华","/eɪˈliːt/","✗","A Cultural Revolution is a movement designed to preserve the political and financial power of a ruling elite by social rather than political or financial means.;Alexander the Great's army numbered an elite cavalry among its ranks.;""Mujtahidd"" has attracted almost 300,000 followers since the end of last year, when he began posting scandalous claims about the Saudi elite."
"empathy","NOUN. 同情，移情，同理心，移情作用，同情心，感同身受，共鸣，心灵相通，同感","/ˈempəθi/","✗","By taking users to places where they would or could not really go, the technology offered empathy or awe via translocation.;She had a lot of empathy for her neighbor; she knew what it was like to lose a parent too.;This family empathy measure is highly related to ever use of birth control but not to any measure of continuous use."
"endanger","VERB. 危及，危害，连累","/ɪnˈdeɪndʒə(r)/","✗","Cumbersome machines can endanger operators and slow down production.;1877, Louisa May Alcott, Under the Lilacs
If you endanger other people's life and liberty in your pursuit of happiness, I shall have to confiscate your arms, boys.;Ben hired a nag, but 'twould stumble of course, / And by falling endanger poor Ben, / Aye, and over her bows, sir, this crazy old horse / Would unship, and unship him again."
"endorse","VERB. 赞同，背书，认可，批注，赞成，支持","/ɪnˈdɔːs/","✗","...to endorse him on the backside of posterity, not a golden, but a brazen Asse...;[…] although most black middle classers remain personally estranged from European ""high art,"" theoretically they endorse it, and thus admire Marsalis's mastery of its forms.;This seems to be due to one factor that they all—the various idealisms, phenomenalisms, positivisms, and panpsychisms—have in common: They reject, or at least fail to endorse, the idea of “matter.”"
"endowment","NOUN. 养老，禀赋，捐赠基金，捐赠，资，捐助，基金会","/ɪnˈdaʊmənt/","✗","[…] the woman with larger-than-usual breasts will be initially perceived only as a sex object if she doesn't take steps to disguise her endowment.;a rich endowment; a rich dress; rich silk or fur; rich presents;Palestine is described as an “Islamic Waqf”—an endowment predicated on Muslim religious, education, or charitable principles and therefore inviolate to any other peoples or religions."
"enemy","NOUN. 敌人，敌军，敌，敌方，仇敌，仇人，敌对，对手","/ˈenəmi/","✗","under enemy duress;Rally together against a common enemy.;The building was destroyed by enemy bombing."
"enforcement","NOUN. 强制执行，执法，执行，实施，强制，检控","/ɪnˈfɔːsmənt/","✗","They had immediately computered the description out to the scores of law enforcement agencies in Southern California.;The War on Drugs proved popular among key white voters, particularly whites who remained resentful of black progress, civil rights enforcement, and affirmative action.;Law enforcement assembled a profile of the suspect."
"enlistment","NOUN. 入伍，登记","/ɪnˈlɪstmənt/","✗","To assess this hypothesis, the urbanicity of a boy's place of residence was run against enlistment.;When a girlish-toned, big physiqued young man confronted Surgeon Rogers to-day and asked for examination preliminary to enlistment, his training stood him in good stead.;My dad told me about his days in the Navy: He'd agreed to be a guinea pig in exchange for a shorter enlistment. […] They baked him in the sun."
"entrench","VERB. 巩固","/ɪnˈtrentʃ/","✗","Senator Cornpone was able to entrench by spending millions on each campaign.;And the longer the fighting drags on, the more radicalized Syrian society becomes and the deeper the Iranians can entrench themselves.;The Western Powers helped the World Revolution to entrench itself deep in Europe."
"epidemic","NOUN. 流行病，流行，疫情，传染病，疫症，流行病学 ADJ. 流行性，防疫，疫","/ˌepɪˈdemɪk/","✗","Epidemic hysteria occurred upon the incumbent’s reelection.;[In] May, there was, at London and in its neighbourhood, a disease very epidemic, though not fatal, which had some time before been very prevalent both in Italy and Germany.;The major reason for such an examination was to determine if any patterns uncovered seemed to be more epidemic than endemic."
"erode","VERB. 侵蚀，蚕食，削弱","/ɪˈrəʊd/","✗","[…] but in the long run, the casino's PC (percentage) for casino games will erode your bankroll.;to erode a person's trust;to erode society's moral"
"evict","VERB. 驱逐，赶走","/ɪˈvɪkt/","✗","The police arrived swiftly, deciding it would be safer to keep watch over the fiesta rather than forcefully evict thousands of revellers.;When the workers rejected these terms, some planters threatened to evict them, and others unroofed cottages and turned estate cattle through the workers’ provision grounds.;The law describes a lot of situations where this right they do not lose even when selling apartments, so you will not get them to evict or remove from registration."
"exceed","VERB. 超过，超逾，超出，超越，超","/ɪkˈsiːd/","✗","Given the economic realities of contemporary Poland, a requirement to provide information on movable assets which exceed PLN 10,000 in value cannot be held to be excessive.;Your password cannot exceed eight characters.;And to speak impartially, old Men, from whom we should expect the greatest example of Wisdom, do most exceed in this point of folly […]."
"exemplary","ADJ. 模范，示范，典范，效仿","/ɪɡˈzempləri/","✗","Her behaviour was always exemplary.;For thus the Saviour of the world became humane, alluring, full of invitation and the ſweetneſſes of love, exemplary, humble and medicinal.;… I want to round off my consideration of poststructuralist geographies by pursuing origami as the exemplary art of spatial science."
"expertise","NOUN. 专业知识，专长，特长，鉴定，专家","/ˌekspɜːˈtiːz/","✗","The scientist has expertise in the field of nuclear fusion.;He spoke of Scotland's hydroelectric projects in Africa, local expertise shared with the world's poor.;Including a plurality of different expertise in the decision-making processes corresponds to expertising the democratic procedures."
"explicit","ADJ. 显式，明确，显性，露骨，显，明晰，清晰","/ɪkˈsplɪsɪt/","✗","Coordinate term: simile (when the similarity is made explicit by the words like or as);I gave explicit instructions for him to stay here, but he followed me, anyway.;The film had several scenes including explicit language and sex."
"extraneous","ADJ. 不相干，无关，多余，外来","/ɪkˈstreɪniəs/","✗","to separate gold from extraneous matter;Extraneous substances were found on my cup of water.;Many formalisms for belief revision use extraneous mechanisms for deciding what beliefs to keep and this makes it harder to iterate the process."
"fabrication","NOUN. 制造，制作，制备，捏造，加工，虚构","/ˌfæbrɪˈkeɪʃn/","✗","the fabrication of a bridge, a church, or a government;The story is doubtless a fabrication.;Fabrication has been the method used in the construction of many components that would normally be made from steel castings and forgings."
"facsimile","NOUN. 传真，图文传真，传真机，图文","/fækˈsɪməli/","✗","To paraphrase the critic of the Times, if one may make the facsimile of a human being out of bronze, why not the facsimile of a Brillo carton out of plywood?;1900, Eve Emery Dye, McLoughlin and Old Oregon, 2005 facsimile edition, page 56,
That wedding of the fur companies is historic.;The following list summarises all facsimile reprintings to the end of 2017."
"fascist","ADJ. 法西斯，法西斯主义","/ˈfæʃɪst/","✗","I have a fascist boss.;Mussolini was a fascist well known for his repression of criticism and totalitarian government.;Fascist? I'm not fascist. You're the fascist!"
"federal","ADJ. 联邦","/ˈfedərəl/","✗","There has been a cutback in federal subsidies. Rates have been increasing too.;Territorians also could elect a representative to Federal Parliament (a right granted in 1923).;Here every means is made use of to do away all distincting between federal and antifederal and I suspect with no very friendly design to the federal cause."
"ferocious","ADJ. 凶猛，凶恶，狰狞，凶残，勇猛，凶狠，凶，猛烈，残忍，残暴","/fəˈrəʊʃəs/","✗","Guitarist Jade Puget and vocalist Davey Havok have distilled AFI’s strengths (a ferocious, post-hardcore rhythmic backbone; goth-tinctured, post-punky guitars; and Havok’s desperate, dramatic croon) into 14 taut, hook-driven songs.;But he was also, what seems almost incompatible with this ferocious truthfulness, excessively self-conscious and morally attitudinising, a thin-skinned poseur.;The dog sounds ferocious but it's all show."
"figuratively","ADV. 比喻，形象化，象征性","/ˈfɪɡərətɪvli/","✗","(figuratively) He was feeling pasty.;Figuratively, the cat was out of the bag.;to point a dart, a pencil, or (figuratively) a moral"
"filing","NOUN. 归档，备案，立卷，提交，存档，档案，申报","/ˈfaɪlɪŋ/","✗","Mueller said in a court filing that Cohen had admitted he briefed Trump and unidentified Trump family members about the progress of the project more extensively than was previously known.;I would like to know your opinions on the new filing system.;The applicants kept filing into the room until it was full."
"fiscal","ADJ. 财政，财，财税，理财，财务","/ˈfɪskl/","✗","fiscal matters;fiscal lawyer;fiscal system"
"fist","NOUN. 拳头，拳，握拳，拳脚","/fɪst/","✗","Garrus: Fist knows you're coming. We'll have a better chance if we all work together.
Wrex: My people have a saying: Seek the enemy of your enemy, and you will find a friend.;to open a closed fist;The other man stumbled up, rubbing his temple. “Jesus,” the man said. Frank raised his fist, then saw that the man was Jesusing not him but [the window]."
"flaw","NOUN. 缺陷，瑕疵，漏洞，缺点，缺失，破绽，裂纹，弱点","/flɔː/","✗","There is a flaw in that knife.;That vase has a flaw.;a flaw in a will, in a deed, or in a statute"
"foe","NOUN. 敌人，仇敌，对手，仇人，对头，敌","/fəʊ/","✗","Give me a clean sword and a clean foe to flesh it in.;a sworn foe;North Korea loves to spring surprises. More unusual is for its US foe to play along."
"foment","VERB. 煽动","/fəˈment/","✗","Foreign governments have tried to foment unrest.;The maid had entered with us, and began once more to foment the bruise upon her mistress's brow.;He came in no conciliatory mood, and the foment was kept up."
"footage","NOUN. 镜头，录像，画面，进尺，片段，胶片，素材，录象","/ˈfʊtɪdʒ/","✗","The video includes unreal footage of an eight-metre wave.;The footage we shot at the riot yesterday got ruined.;The streamer was the first to cast footage of the new game."
"frontier","NOUN. 边疆，前沿，边境，边防，边塞，国境，前线，边界","/ˈfrʌntɪə(r)/","✗","the frontier of civilization;He will Christmas at Calcutta, and then make a tour through Bengal, and pay a visit to the frontier.;1911, 1911 Encyclopædia Britannica, Hazara
The chief frontier tribes on the border are the cis-Indus Swatis, Hassanzais, Akazais, Chagarzais, Pariari Syads, Madda Khels, Amazais and Umarzais."
"frustrate","VERB. 挫败，阻挠，挫伤 NOUN. 挫折","/frʌˈstreɪt/","✗","My clumsy fingers frustrate my typing efforts.;frustrate the best endeavours in the edifying of the church;[…] a change in prices and rewards, as measured in money, generally affects different classes unequally […] and redistributes Fortune’s favours so as to frustrate design and disappoint expectation."
"fundraise","NOUN. 募捐","/ˈfʌndreɪz/","✗","Daniel's uncle volunteered to help fundraise for his nephew's class trip to Chile;My dear friend, Miss Thanh and her group have started to fundraise for a reading room for TTO.;This time, we asked Mr. Numata, one of the first to use the internet to fundraise and a driver of the industry, about the potential and challenges of ICOs."
"galactic","NOUN. 银河 ADJ. 银河系，星系，星际","/ɡəˈlæktɪk/","✗","Galactic astronomy is the study of the Milky Way.;Yes, his heart is one of galactic proportions.;galactic acid"
"gangster","NOUN. 黑帮，强盗，歹徒，匪徒，黑社会，土匪，黑帮分子，混混，暴徒","/ˈɡæŋstə(r)/","✗","[Gangster running away:] Batman and Robin! Let's lam!;Dante: Whose house was it?
Blue-Collar Man: Dominick Bambino's.
Randal: ""Babyface"" Bambino? The gangster?
Blue-Collar Man: The same. http://www.whysanity.net/monos/clerks5.html;paper tiger; paper gangster"
"gazillion","NOUN. <口>许许多多","/ɡəˈzɪljən/","✗","Even if you are not a transistor collector, it is still pretty neat seeing that many early transistors. Wowzers...yes indeed...wowzers! Ok...it is not a gazillion but sure is a bunch.;She was bigger than any exaggeration of most feet, more than a million, gazillion, googolduplex, […] more than much, much more than all fathoms, feet, miles, or anything anything.;The only thing that really bothered me were the gazillion alarm clocks."
"geopolitical","ADJ. 地缘政治，地缘","/ˌdʒiːəʊpəˈlɪtɪkl/","✗","Ukrainian intelligence said on Friday that Prigozhin’s public bickering with the army leadership confirmed “their fear of responsibility for the inevitable geopolitical defeat of Moscow”.;The “Swissie"", which is the trader talk for the currency, has been a safe haven currency in the past, especially during times of financial and geopolitical instability.;Cambodia's apparent relative insignificance belied its geopolitical importance."
"glycerin","NOUN. 甘油","/ˈɡlɪs.ər.iːn/","✗","It looks like any other clear glycerin soap and acts like it, too, except that it smells very pepperminty and left my skin smelling sort of sharp.;Following examination genitalia were stored in fresh glycerin in a microvial pinned below the specimen.;Finally an ecouvillon soaked in creasote and glycerin is introduced."
"grab","VERB. 抓住，抢，抓，攫取，拿，抓取，抓起 NOUN. 抓斗","/ɡræb/","✗","How does that idea grab you?;Baby, instant soup doesn't really grab me
Today I need something more substantial;Come in and grab a seat [i.e. sit down]."
"guerilla","NOUN. 游击，游击队，游击战，游击队员","ɡɛrˈɪlə","✗","I'd guerilla my Watusi ass into a chrome-and-leather ho den and gattle-gun my pimp-dream shit into some mud-kicker's frosty car.;The weaponry at their disposal was said and shown in numerous video footages to be mainly small arms and anti-tank rocket launchers, etc. — the 'classical' arms of the guerilla.;The first one is very artistic work, ""Asagao"" by Hotaru Visual Guerilla from Spain."
"guilty","ADJ. 有罪，内疚，愧疚，犯，心虚，罪恶感，认罪，罪，罪恶","/ˈɡɪlti/","✗","He was guilty of cheating at cards.;The guilty man was led away.;Do you have a guilty conscience?"
"hagwon","X. [网络] 补习班","hˈaɡwʌn","✗","Geneho, whose bedroom faces the street, is attending a hagwon, a Korean tutoring program.;At the essay competition award ceremony that followed, student Lee Ga-young (2nd grader of Baekdu Hagwon) won the grand prize with the topic ""Becoming One."""
"haul","NOUN. 长途，拖运，牵引，重载 VERB. 拖拉","/hɔːl/","✗","to haul logs to a sawmill;Getting to his place was a real haul.;The robber’s haul was over thirty items."
"heritage","NOUN. 遗产，文物，传承，底蕴，传统，积淀，继承，古迹，遗迹，血统","/ˈherɪtɪdʒ/","✗","Again, it's unlikely they will return to traffic, but futures have been secured for four that will be heading to heritage railways ….;a heritage speaker; a heritage language;The university requires heritage Spanish students to enroll in a specially designed Spanish program not available to non-heritage students."
"heroic","ADJ. 英勇，英雄，壮烈，豪迈，英雄主义，英雄气概，英姿","/həˈrəʊɪk/","✗","heroic deeds;To stand upon the ramparts and die for our principles is heroic. To sally forth to battle and win for our principles is something more than heroic.;The heroic soldier covered himself with glory."
"heuristic","ADJ. 启发式，启发，试探性 NOUN. 启发性","/hjʊəˈrɪstɪk/","✗","The interest here is […] to construct for heuristic purposes a triptych of different “roads to salvation” as reflected in domains of preaching of contemporary Egypt.;Then a dimensionwise heuristic and a vectorwise heuristic are applied sequentially.;We have previously said that the heuristic algorithms produce good nuggets for most classes and most λ values […]"
"hurl","VERB. 投 NOUN. 怒吼","/hɜːl/","✗","Pass me the bucket; I've got to hurl.;He managed a hurl of 50.3 metres.;The Gods, with horror and amaze, look’d down,
Beholding rocks from their firm basis rent;
Mountain on mountain thrown,
With threatening hurl, that shook th’ aethereal [var.: aerial] firmament!"
"hygiene","NOUN. 卫生，衞生，生，保健","/ˈhaɪdʒiːn/","✗","oral hygiene;Hygiene is an important consideration in places where food is prepared.;They have poor personal hygiene."
"iconic","ADJ. 象似，具代表性，标志，象征性","/aɪˈkɒnɪk/","✗","an iconic move in martial arts;For younger musicians, Coltrane’s death became one of those iconic events that stays vividly in the mind.;She angrily turned, giving me my favorite view, that iconic view of a woman from the rear."
"ideological","ADJ. 思想，意识形态，思想上","/ˌaɪdiəˈlɒdʒɪkl/","✗","I have used the term ""liberal solidarity"". It needs to stake out its ideological territory and to debate not only with socialism and conservatism, but with other varieties of liberalism.;Republican ideology had no obvious institutional focus and ideological carrier as was the case with the discourse of reason (the monarchy) and the discourse of law (the parlements).;The cult's ideological substance was the popular digest dubbed by foreigners the Little Red Book or the Bible of Maoism."
"ignorance","NOUN. 无知，愚昧，蒙昧，愚昧无知，一无所知，忽视","/ˈɪɡnərəns/","✗","[H]e speaks a languages that merits not reply, and which can only excite contempt for his prostitute principles, or pity for his ignorance.;She shows total ignorance about the topic at hand.;If he got flamed for his lies or his ignorance, he simply moved to another chat room."
"illuminate","VERB. 照亮，阐明，照明 NOUN. 照射","/ɪˈluːmɪneɪt/","✗","A light that is one foot away from the subject's face will completely illuminate the face, but leave the rest of the body softer and darker.;Hodgson's approach may not illuminate proceedings in Poland and Ukraine but early evidence suggests they will be tough to break down.;February 28 1630, Joseph Hall, The Hypocrite
do ye see an illuminate elder of the anabaptists rapt in divine ecstasies?"
"illustrate","VERB. 说明，举例说明，阐明，演示，阐释","/ˈɪləstreɪt/","✗","We illustrate our definitions by including quotations or simple examples.;Seeds found in a 1630s refuse-filled clay borrow pit, located near an apothecary, illustrate colonists intense interest in experimenting with the medicinal qualities of New World plants.;There have been three famous talkers in Great British, either of whom would illustrate what I say about dogmatists."
"immune","ADJ. 免疫，机体免疫，免疫力，幸免","/ɪˈmjuːn/","✗","As a diplomat, you are immune from prosecution.;Bret Stephens believed that, by virtue of his comfortable position at the New York Times, he ought to be immune from insult or criticism.;I am immune to chicken pox."
"implicit","ADJ. 隐式，内隐，隐含，隐性，隐，含蓄，暗含，内含","/ɪmˈplɪsɪt/","✗","Coordinate term: (when the comparison is implicit) metaphor;He is not only a zealous advocate for pusilanimous and passive obedience, but for the most implicit faith in the dictatorial mandates of power.;You better call the Super if you want your repairs done [the specific superintendent in the implicit context of a specific apartment building; parallel with ""President"" versus ""president""]"
"incendiary","ADJ. 煽动性，燃烧","/ɪnˈsendiəri/","✗","As though on an incendiary rampage, the fires systematically devoured the contents of Edison's headquarters and facilities.;We saw photographs of bodies riddled with pellets from fragmentation bombs or charred by incendiary weapons (besides napalm, the Americans also drop white phosphorus, Thermit, and magnesium on the Vietnamese).;Politics is an incendiary topic; it tends to cause fights to break out."
"incompetent","ADJ. 无能，称职，不济，蹩脚","/ɪnˈkɒmpɪtənt/","✗","Having an incompetent lawyer may be grounds for a retrial, but the lawyer in question probably doesn't know that.;The charged was judged incompetent to stand trial, at least until his medication started working.;The angry captain typified all new sailors as incompetent."
"inconsistency","NOUN. 不一致性，不一致，前后矛盾","/ˌɪnkənˈsɪstənsi/","✗","Jocose flesh-eaters take a malicious delight in pointing out and enumerating to Vegetarians the many animal substances now in common use, and in taunting them with inconsistency in using them.;Lenin's Marxist tendencies were underscored by his beliefs in state capitalism and the inconsistency of socialist democracy with the rule and dictatorship of one individual.;Thus, this is a tricky tip; Port’s inconsistency combined with the higher ladder placing of Adelaide have me leaning the latter’s way."
"incur","VERB. 招致","/ɪnˈkɜː(r)/","✗","2002 I have a major confession to make which will probably incur the wrath of all Trekkies out there. — Trek & Treat, article in The Daily Mirror (UK), Jessica Mellor, Saturday, August 10, 2002, page 44.;[T]he master in his wrath may easily incur worse evil himself than he inflicts—…;Accomplices of a crime or an offence shall incur the same punishment as the authors of such a crime or offence, except when the law will have disposed otherwise."
"indecisive","ADJ. 优柔寡断，举棋不定，犹豫不决，拿不定主意","/ˌɪndɪˈsaɪsɪv/","✗","Whether he believed himself a god, or only took on the attributes of divinity from motives of policy, is a question for the psychologist, since the historical evidence is indecisive.;They were all being very indecisive about what to wear to the party.;The outcome of the race was so indecisive."
"indefensible","ADJ. 理亏，站不住脚，不可原谅","/ˌɪndɪˈfensəbl/","✗","De Toni’s placing the quadrate form in Amphitetras and the sextate in Nothoceratium is of course indefensible.;There was a querulous letter from an ANU international relations academic who thought my idea flawed since the communists would never accept it and the enclave would be indefensible anyway.;""DAE has to let go of scientifically indefensible positions like its claims that its reactors are '100 percent' safe and that the probability of a nuclear accident is one in infinity, i.e., zero."
